	Question	Anatomy	Cause	Complication	Diagnosis	Information	Management	Manifestation	OtherEffect	PersonOrg	Prognosis	Susceptibility	Other	NotDisease
240	I have Axenfeld-Rieger syndrome.  My symptoms include dislocated pupils and very high astigmatism with a detaching lens. I recently learned that a flattened mid-face, missing teeth, and mid section anomalies are also symptoms of this disorder.  I would like to start a family; however I would first like to learn more about the chances of passing this on to my future children and the likelihood that their condition would be more serious than my own.  Also, the lens in one of my eyes is detaching and migrating away from my displaced pupil.  Is this a common effect of the disease? Can it be treated?	0	0	0	0	0	1	0	1	0	0	1	0	0
241	I have a young friend who is affected by acute febrile neutrophilic dermatosis (Sweet syndrome). Can you provide me with information about this condition that can be shared with her physicians?	0	0	0	0	1	0	0	0	0	0	0	0	0
242	I have Beals syndrome (also known as congenital contractural arachnodactyly). I am a 19-year-old female and I was wondering how tall I would be because of this condition? The symptom is having a tall stature, but how tall? I'm 5'3 right now.	0	0	0	0	0	0	0	1	0	0	0	0	0
243	I have Becker's nevus on the top of my right pectoral. I'm heavily into fitness and weight lifting. I've noticed that it is impossible for me to develop an even chest. Muscle seems to not grow where my nevus is located. Does Becker's nevus prohibit muscle development? Does the nevus affect me in that manner, and if so, is there any way to fix this?	0	0	0	0	0	1	0	1	0	0	0	0	0
244	I have been diagnosed with a benign pseudomyxoma peritonei.  Most of the information I have found relates to the malignant type.  I had a hysterectomy and appendectomy with debulking three weeks ago.  I was told I had a large ovarian tumor plus a tumor on my appendix, which seemed to be the one secreting mucus. What is the treatment for this condition?	0	0	0	0	0	1	0	0	0	0	0	0	0
245	I have been diagnosed with Behcet's disease. Although I have other symptoms, my eyes have been causing me the most trouble. Please tell me more about the ocular issues with Behcet's and how they might be treated.	0	0	0	0	0	1	0	1	0	0	0	0	0
246	I have been diagnosed with cholesteatoma. I am looking for general information about this condition, including the chances of being affected.	0	0	0	0	1	0	0	0	0	0	1	0	0
247	I have been diagnosed with CPVT. I've been off medication for a few years and have been playing sports regularly.  I've never had any syncope. I just read that if untreated CPVT is highly lethal. And now I'm starting to care. I have some questions about this disease: Is there any case of remission? Is it curable? Are sports under treatment better than without treatment? Is there a CPVT specialist anywhere in the world? What is the most up-to-date article/research about this disease?	0	0	0	0	1	1	0	0	1	1	0	0	0
248	I have been diagnosed with erythromelalgia, and received a prescription for mexiletine.  I noticed on the patient information sheet that it said that this medication is an anti-arrhythmic used to treat irregular heartbeat.  Have you heard about mexiletine being used for erythromelalgia?	0	0	0	0	0	1	0	0	0	0	0	0	0
249	I have been diagnosed with familial adenomatous polyposis (FAP), and my 9-year-old daughter is now having the same signs and symptoms as me. I know you can not give out medical advice, but I'm stuck and need some help for my daughter. How do I find a specialist for children with FAP?  At what age do children begin having genetic testing for FAP?	0	0	0	1	0	0	0	0	1	0	0	0	0
250	I have been diagnosed with familial hemiplegic migraine.  Even though I have been taking medication, I am experiencing unsteadiness, headache pain, facial drooping, and I can't walk without getting off balance. It is normal to have these symptoms for three weeks when taking medication for the condition? Will this condition go away with age?	0	0	0	0	0	1	0	0	0	1	0	0	0
251	I have been diagnosed with frontal fibrosing hair loss (alopecia).  Is this condition going to cause all of my hair to fall out or will the hair loss stop at some point?  Will medication help, or are the side effects too concerning?	0	0	0	0	0	1	0	1	0	0	0	0	0
252	I have been diagnosed with intralobular pulmonary sequestration. What are the symptoms of this condition? How is it treated?	0	0	0	0	0	1	1	0	0	0	0	0	0
253	I have been diagnosed with Isaac's syndrome. I would like to learn more about this condition and how I can locate physicians familiar with it's management.	0	0	0	0	1	0	0	0	1	0	0	0	0
254	I have been diagnosed with Melnick-Needles syndrome.  How can I learn more about this disease?	0	0	0	0	1	0	0	0	0	0	0	0	0
255	I have been diagnosed with MERRF and I am looking for information and treatment options for this condition that I can share with my local doctor.	0	0	0	0	1	1	0	0	0	0	0	0	0
256	I have been diagnosed with morphea. Can you please provide me with patient-friendly information about this disease?	0	0	0	0	1	0	0	0	0	0	0	0	0
257	I have been diagnosed with Mucha-Haberman disease. I don't know how I contracted this disease. For a couple of years, I was very sick and couldn't seem to get well. Now my symptoms flare up occasionally but I have blisters all of the time. What causes this condition? How is it treated?	0	1	0	0	0	1	0	0	0	0	0	0	0
258	I have been diagnosed with Norum disease, a condition also known as lecithin cholesterol acyltransferase (LCAT) deficiency. I would appreciate any information that you could provide and post about this disease, as three generations of my family have been identified with it.	0	0	0	0	1	0	0	0	0	0	0	0	0
259	I have been diagnosed with pheochromocytoma but believe that there is more to this than has been tested thus far. After reading numerous literature on everything I could find, I realized that something genetic and family based was taking place. Can you help me?	0	0	0	0	0	0	0	0	0	0	1	0	0
260	I have been diagnosed with pigmented purpuric eruption. What are the symptoms of this condition? What causes it? Can it be treated? Will it eventually go away?	0	1	0	0	0	1	1	0	0	1	0	0	0
261	I have been diagnosed with polycystic ovarian syndrome (PCOS), but the medication I am taking does not seem to be working. I recently learned that late-onset congenital adrenal hyperplasia can be misdiagnosed as PCOS in some women. Can you help me find information on PCOS and late-onset congenital adrenal hyperplasia?	0	0	0	1	0	0	0	0	0	0	0	0	0
262	I have been diagnosed with primary melanoma of the small intestine. I can't find any information on this type of cancer. Can you help? Is there anyway to find other people with this condition?	0	0	0	0	1	0	0	0	1	0	0	0	0
263	I have been diagnosed with prurigo nodularis. Three years ago I was started on thalidomide for treatment. Since then I have developed many side effects, yet the prurigo nodularis has not been cured. How can this condition be treated? Is research being conducted to learn more about possible treatment options?	0	0	0	0	0	1	0	0	0	0	0	0	0
264	I have been diagnosed with pudendal neuralgia. My doctor has treated it with with pudendal nerve entrapment surgery and botox injections.  Is there any scientific evidence from controlled trials or research studies that show botox is an effective treatment?  Also, are there any other recommended treatments other than what my doctor has already tried for this condition?	0	0	0	0	0	1	0	0	0	0	0	0	0
265	I have been diagnosed with retroperitoneal fibrosis. Can you provide me with information about this disease?	0	0	0	0	1	0	0	0	0	0	0	0	0
266	I have been diagnosed with sarcoidosis. This condition has caused me severe pain and I wish to learn anything that might be useful to share with my doctors. Could this condition be the result of working in a hot silk-screen paint shop? Will I ever get over this condition? How can I manage the symptoms?	0	1	0	0	1	1	0	0	0	1	0	0	0
267	I have been diagnosed with Takayasu arteritis. It has changed my life in many ways and I am yet to accept this condition. It has been very difficult for me to deal with this diagnosis and I'm not sure who to talk to or who to get information from.	0	0	0	0	1	0	0	0	1	0	0	0	0
268	I have been diagnosed with Tarlov cyst disease. Is there a cure for this condition? How is it treated? Are there surgical options? How can I find a doctor who is knowledgeable about Tarlov cysts?	0	0	0	0	0	1	0	0	1	0	0	0	0
269	I have been diagnosed with trabecular fiber myopathy and can find nothing about it. I would like any information you can give me.	0	0	0	0	1	0	0	0	0	0	0	0	0
270	I have been diagnosed with urachal cancer. Are there any new studies or treatments available for this rare disease?	0	0	0	0	1	1	0	0	0	0	0	0	0
271	I have been diagnosed with Wells syndrome. How is this condition treated?	0	0	0	0	0	1	0	0	0	0	0	0	0
272	I have been diagnosed with Wilson disease. What are the long-term effects of this disease? Will I need to be on medication for the rest of my life? Does Wilson disease count as a disability because an affected person has it all of their life? What are the chances that my children will have Wilson disease?	0	0	0	0	0	1	0	0	0	1	1	1	0
273	I have been having very bad upper stomach pains and wanted to know if any of the pains are coming from the Crigler Najjar syndrome, type 2 that I have? I’ve been experiencing this pain for two months.	0	0	0	0	0	0	0	1	0	0	0	0	0
274	I have been on hemodialysis for a year as a result of Alport syndrome. My two uncles died of kidney disease associated with this condition. What treatments are available for this condition?	0	0	0	0	0	1	0	0	0	0	0	0	0
275	I have been recently diagnosed with antisynthetase syndrome, acute interstitial lung disease, muscle weakness, skin involvement, scleroderma, and dermatomyositis. Could you please provide me with information on antisynthetase syndrome?  I am also interested in learning about prognosis, treatment, and clinical trials.	0	0	0	0	1	1	0	0	0	1	0	0	0
276	I have been recently diagnosed with Evans syndrome. Can you provide me with information about this condition, including treatment options and mortality rates?	0	0	0	0	1	1	0	0	0	1	0	0	0
277	I have been recently diagnosed with superior mesenteric artery syndrome. Can you provide me with information about this condition?	0	0	0	0	1	0	0	0	0	0	0	0	0
278	I have been recovering from Parsonage Turner syndrome for years. I still have some pain, the fatigue is still with me and my quality of life is compromised. Can this develop into something else? Also, is it normal that I still have fatigue after 5 plus years?	0	0	0	0	0	0	0	1	0	0	0	0	0
279	I have been researching familial hypercholesterolemia. A couple of web sites have called it autosomal dominant. If I remember correctly that would mean that in order for a person to have FH, he would have to have a parent with FH. Is my thinking correct on this matter?	0	0	0	0	0	0	0	0	0	0	1	0	0
280	I have been told that I probably have Marfan's Syndrome and at this point it appears to be a mild form of the condition (aortic aneurysm and mitral valve prolapse). I am a 60 year old mother of 4 children. My question is that because this is a genetic condition, what are the chances that my children and grandchildren have inherited it and will they also inherit the mild form?	0	0	0	0	0	0	0	0	0	0	1	0	0
281	I have cherubism. I was diagnosed at age 3 and had the tumor surgically removed at age 13. Then I had implants placed for permanent teeth at age 20. Today I live normally. My main concern and reason for contact is: I'd like to know more about the cause of cherubism. How or why did I get it? There is no history in either of my families of cherubism. What are the signs and symptoms of cherubism? Do my future children run a strong risk? Can I be tested to see if I am a carrier? If I find that I am not a carrier can they still turn up with the disease? Is there prenatal testing available for cherubism. As you can see, I am mostly concerned for the future of my family. I do not have kids yet, but do plan to.	0	1	0	1	0	0	1	0	0	0	1	0	0
282	I have cone-rod dystrophy. I have looked all over the internet for answers about my condition. Do you have information about treatments or possible future treatments? Are there any studies or trials that are being done that I might be able to take part in?	0	0	0	0	1	1	0	0	0	0	0	0	0
283	I have congenital ichthyosiform erythroderma since birth. I want to know if there is any treatment because I am really looking to get treatment for this disease.	0	0	0	0	0	1	0	0	0	0	0	0	0
284	I have dense deposit disease. Are nausea and vomiting symptoms of the disease?	0	0	0	0	0	0	1	0	0	0	0	0	0
285	I have diffuse idiopathic skeletal hyperostosis (DISH), a condition also known as Forestier disease. I would like to learn more about this disease, including how it is treated.	0	0	0	0	1	1	0	0	0	0	0	0	0
286	I have disseminated granuloma annular. Will this condition cause my tissue to die? Have there been reports of granuloma annular following ingestion of allopurinol?	0	1	0	0	0	0	0	1	0	0	0	0	0
287	I have Duane syndrome. These is no known family history. What the probability of passing this condition on to any future offspring?	0	0	0	0	0	0	0	0	0	0	1	0	0
288	I have Dubin-Johnson syndrome. Can this condition be passed along to another individual through sexual intercourse?	0	0	0	0	0	0	0	0	0	0	1	0	0
289	I have endocarditis for the fourth time. Each time it has been caused by the same bacteria. How can I prevent reinfection?	0	0	0	0	0	1	0	0	0	0	0	0	0
290	I have epidermolysis bullosa acquisita. Occasionally I have to have my fingernails removed, as they act like ingrown toe nails. My doctors tell me there is no other way to prevent them from growing back, except for phenol carbolic acid, and I had a reaction to that when they took off a toe nail. In addition, I would like to contact other people with epidermolysis bullosa acquisita.	0	0	0	0	0	0	0	0	1	0	0	0	0
291	I have erythema elevatum diutinum. How might this condition be treated? Will I ever be able to take less medication? Can diet affect this condition? Will it ever go away? Is this condition genetic?	0	0	0	0	0	1	0	0	0	1	1	0	0
292	I have experienced several bouts of hiccups that go on for several weeks to months with no relief. I have had all of the normal tests to determine a cause, but no cause has been identified. I also have other stomach problems. What causes intractable hiccups? What tests may be conducted to determine the underlying cause of intractable hiccups? Can intractable hiccups be related to other stomach problems? How might intractable hiccups be treated?	0	1	0	1	0	1	0	1	0	0	0	0	0
293	I have factor V Leiden and was wondering if it's safe to use oral contraceptives. I want to take the pill called Levlin.	0	0	0	0	0	0	0	1	0	0	0	0	0
294	I have familial adenomatous polyposis (FAP). Recently, my physicians have identified polyps in the upper portion of my intestine, my gall bladder, and my stomach. Are these all the same type of polyps?	0	0	0	0	1	0	0	0	0	0	0	0	0
295	I have fibrodysplasia ossificans progressiva and recently had my first fracture.  I am currently taking medication but continue to have pain in my leg, hand, and elbow.  What are the risks of operation?  Can myositis ossificans be passed to the next generation?	0	0	0	0	0	1	0	0	0	0	1	0	0
296	I have fibromuscular dysplasia in several of my arteries. My doctor says this condition is usually caused from smoking, but I have never smoked. What would cause this disease to occur in so many arteries?	0	1	0	0	0	0	0	0	0	0	0	0	0
297	I have fibromyalgia and am concerned that my family members will develop, especially my daughter who is beginning to have symptoms of the condition.  Is fibromyalgia genetic?  Is there genetic testing for the condition?	0	0	0	1	0	0	0	0	0	0	1	0	0
298	I have glycogen storage disease type 5. I have also had fatty liver for as long as I can remember. In addition my CPK levels on a good day can be 800. Can my liver problems be attributed to glycogen storage disease type 5?	0	0	0	0	0	0	0	1	0	0	0	0	0
299	I have green eyes with a yellow/brown tint, but one fourth of my right eye is dark brown.  I've been wanting to know more about heterochromia iridis: what is it and how rare is it?	0	0	0	0	1	0	0	0	0	0	1	0	0
300	My father had arachnoiditis. Can you provide information about this condition, including symptoms, causes, and if it is genetic?	0	1	0	0	1	0	1	0	0	0	1	0	0
301	My father has Buschke Fischer keratoderma palmo-plantaris. Is there any treatment for this condition?	0	0	0	0	0	1	0	0	0	0	0	0	0
302	My father has Crohn's disease for which he has had many surgeries in his lifetime. His brother (my uncle) also had this disease as a young adult.  Can you tell me what percent chance I would have of having this disease as well? My fathers other young adult children do not have it as of yet.	0	0	0	0	0	0	0	0	0	0	1	0	0
303	My father has multiple system atrophy with orthostatic hypotension.  Is this hereditary?  Is this something my brother and sisters or our children should make our doctors aware of in case symptoms start appearing?	0	0	0	1	0	0	0	0	0	0	1	0	0
304	My father is 63 years old and suffers from Shapiro syndrome. So far no doctor or treatment plan has helped. The condition and length of time of the attacks continue to get worst.	0	0	0	0	0	1	0	0	1	0	0	0	0
305	My father may have this disease. Should I be tested? Where? How? If this is caught early can anything be done about it? What treatment opportunities are there? Is this limited to French Canadians? We cannot trace our genealogy back to French Canada but we do know that some of our ancestors came from Europe.	0	0	0	1	0	1	0	0	1	0	1	0	0
306	My father was diagnosed with cerebellar degeneration. He isn't on any medication and he feels terrible all the time. Is there anything out there that can help him such as medications or alternative therapies?	0	0	0	0	0	1	0	0	0	0	0	0	0
307	My father was diagnosed with dermatomyositis and has some long-lasting symptoms.  Is it possible that radiation exposure could be contributing to his condition?	0	1	0	0	0	0	0	0	0	0	0	0	0
308	My father was diagnosed with epidermoid carcinoma in his mouth. Is this curable?	0	0	0	0	0	1	0	0	0	0	0	0	0
309	My first child has the gene responsible for pyruvate kinase deficiency. Are there ways to monitor for this condition prenatally? Where can we access genetic testing for pyruvate kinase deficiency?	0	0	0	1	0	0	0	0	0	0	0	0	0
310	My first episode of Behcet's disease was pretty mild. Is my next episode likely to be the same or progress to a more aggressive event?	0	0	0	0	0	0	0	0	0	1	0	0	0
311	My foster child will be tested for Prader-Willi syndrome, but has a very high IQ. Is it possible for people with Prader-Willi to have high IQs?	0	0	0	0	0	0	0	1	0	0	0	0	0
312	My four-year-old daughter has been diagnosed with hypomyelination with atrophy of basal ganglia and cerebellum (H-ABC).  It is apparently quite rare and we would like information on this condition.	0	0	0	0	1	0	0	0	0	0	0	0	0
313	My friend has a relative who has asternia.  What are the symptoms of asternia?  What are the treatments for this condition?	0	0	0	0	0	1	1	0	0	0	0	0	0
314	My friend has been diagnosed with Boeck's sarcoidosis. What is it? What can be done and how does it work? What natural therapy can be used?	0	0	0	0	1	1	0	0	0	0	0	0	0
315	My friend has Best disease in his right eye. His vision in this eye is quite stable, although he sees a black spot wherever he focuses. Will his vision remain the same or it can it deteriorate? Is there any way to improve his vision? What are the chances of his left eye also developing Best disease?	0	0	0	0	0	1	0	1	0	1	0	0	0
316	My friend has hidradenitis suppurativa. Can you please help me find more information?	0	0	0	0	1	0	0	0	0	0	0	0	0
317	My friend is 48-years-old and has had hypertension for more than 15 years. Her potassium levels are always elevated and her doctors do not know why. Her serum creatinin is normal. Do you think she has pseudohypoaldosteronism type II?	0	0	0	1	0	0	0	0	0	0	0	0	0
318	My friend's 3-year-old daughter was just diagnosed with Rett Syndrome. A boy sibling was born last week, and he does not have Rett syndrome. Where can we find more information? How do you become part of a clinical trial?	0	0	0	0	1	0	0	0	1	0	0	0	0
319	My friends little boy is 3-years-old and has been diagnosed with Chiari malformation type 1. Could you tell me how it will affect his life? Is the outcome good or bad? He suffers from headaches at the moment.	0	0	0	0	0	0	0	0	0	1	0	0	0
320	My friend was diagnosed with chronic inflammatory demyelinating polyneuropathy several months ago. He has been treated with platelet transfusions and gabapentin without relief. Are there other options for treatment? What is the outlook for this condition?	0	0	0	0	0	1	0	0	0	1	0	0	0
321	My friend was recently diagnosed with Horner syndrome. I am trying to find information and resources regarding this topic.	0	0	0	0	1	0	0	0	0	0	0	0	0
322	My girlfriend has Best vitelliform macular dystrophy and I feel helpless because she tells me there is nothing anyone could do. Are there any clinical trials or research studies for this type of disease? Is there any treatment that can help? Also, can you go completely blind from this condition?	0	0	0	0	1	1	0	1	0	0	0	0	0
323	My girlfriend has this disease. Can you please provide some basic information on this disease including treatment and possible outcomes? How long does it take for eye sight to deteriorate?	0	0	0	0	1	1	0	0	0	1	0	0	0
324	My girlfriend's grandmother has Myotonic dystrophy type 1.  Fortunately neither my girlfriend's mother nor father is affected, but this disease is quite common in her mother's family.  I want to know the probability that either my girlfriend or our children could get this disease.	0	0	0	0	0	0	0	0	0	0	1	0	0
325	My girlfriend's maternal aunt has vitiligo. What are the chances for our children to have vitiligo?	0	0	0	0	0	0	0	0	0	0	1	0	0
326	My girlfriend's physicians think that she may have Susac syndrome. Can you provide us with some more information about this disease, particularly how it is treated and what we might expect in terms of prognosis?	0	0	0	0	1	1	0	0	0	1	0	0	0
327	My granddaughter had familial hemophagocytic lymphohistiocytosis when she was 8 months old. Can her brothers also develop this disease? I have noticed that both of the boys have had skin problems but the older one, now 13, has developed asthma and unexplained headaches. My granddaughter received a BMT from the 2nd born who is now 11 years old. Is there any testing we can have done to check the boys for the presence or absence of the disease?	0	0	0	1	0	0	0	0	0	0	1	0	0
328	My granddaughter has been diagnosed with pyruvate kinase deficiency. I have many questions about this condition, including how many people may be affected and if it is more common in any particular population. Any information you could provide would be helpful.	0	0	0	0	1	0	0	0	0	0	1	0	0
329	My granddaughter has just been diagnosed with glycine encephalopathy. She is 3 months old. All the articles we have read are very complicated. What is glycine encephalopathy about? What treatment is there and what are her survival chances?	0	0	0	0	1	1	0	0	0	1	0	0	0
330	My granddaughter is 6-months-old and has microcephaly. The geneticist said there is a slight possibility she has COFS syndrome. Can you please give us more information?	0	0	0	0	1	0	0	0	0	0	0	0	0
331	My granddaughter was diagnosed from a genetic blood test with Noonan syndrome, and has a mutation in the SOS1 gene. She is only 3 months old and has already had 3 operations due to stridor. She also has a heart murmur and pulmonary stenosis. She is not eating and has had to have a feeding tube. My daughter and son-in-law need help in knowing what is best to do for her.	0	0	0	0	0	1	0	0	0	0	0	0	0
332	My granddaughter was recently diagnosed with arachnoid cysts. Can you provide me with information about this condition? Is it genetic?	0	0	0	0	1	0	0	0	0	0	1	0	0
333	My grandfather just recently found out he has polycystic kidney disease, and I am curious to know if I have it also. I am 20 years old and have experienced some symptoms. What is the best way to go about testing for this condition? What kinds of tests do they run?	0	0	0	1	0	0	0	0	0	0	0	0	0
334	My grandmother on my dad's side has two copies of the factor V Leiden gene mutation. I have one copy. Do I need to go and see a hematologist to get on blood thinners, or is there really nothing that they would do since I only have the one copy? Also, if I have one copy does that mean that my father has two copies of it or could he possibly have only the one copy as well?	0	0	0	0	0	1	0	0	0	0	1	0	0
335	My grandson has been diagnosed with hereditary fructose intolerance. The family has not been able to see a dietician, and they are having a hard time finding good recipes. Please give me some info so I can help them.	0	0	0	0	1	0	0	0	0	0	0	0	0
336	My grandson has been diagnosed with LEOPARD syndrome. We have just noticed that his eyes are beginning to cross. Is this a sign also?	0	0	0	0	0	0	1	0	0	0	0	0	0
337	My grandson has Joubert syndrome, autism, and ADHD.  Is autism related to Joubert syndrome?	0	0	0	0	0	0	0	1	0	0	0	0	0
338	My grandson has Lenz microphthalmia syndrome. Is there any information in the medical literaure, research studies, or clinical trials regarding the effectiveness of expansion thoracostomy (VEPTR) for treatment of children with this syndrome?	0	0	0	0	0	1	0	0	0	0	0	0	0
339	My grandson has the condition. I want to know if there is medication that will result in a normal stature.	0	0	0	0	0	1	0	0	0	0	0	0	0
